{
  "version": "ruhroh_scenario_v2",
  "id": "simple-newsletter",
  "title": "Simple Newsletter",
  "tier": "smoke",
  "kind": "real_user",
  "metadata": {
    "scenarioVersion": "1.0.0",
    "provenance": "Original Ruhroh bundled smoke scenario for credential-free local-app validation.",
    "createdAt": "2026-06-23",
    "updatedAt": "2026-07-07",
    "difficulty": "intro",
    "tags": [
      "local-app",
      "static-ui",
      "smoke"
    ],
    "expectedRuntimeSeconds": 420,
    "contaminationNotes": "Small original smoke task with no canonical public solution.",
    "maintainers": [
      "ruhroh-maintainers"
    ],
    "visibility": "public",
    "changelog": [
      "1.0.0: Initial published scenario."
    ],
    "lifecycle": {
      "status": "active"
    }
  },
  "userPromptPath": "instruction.md",
  "run": {
    "mode": "build",
    "timeoutSeconds": 420
  },
  "requires": {
    "continuity": "workspace_plus_transcript",
    "tools": [
      "filesystem",
      "shell"
    ],
    "network": false
  },
  "loop": {
    "defaultMaxIterations": 3,
    "stopPolicy": "goal_satisfied_or_max"
  },
  "evaluation": {
    "mode": "agentic_goal_review",
    "scenarioContext": [
      "This is a tiny local-app smoke task.",
      "The user did not prescribe a framework or file layout."
    ],
    "goalRubric": [
      "The final workspace provides a locally viewable newsletter page.",
      "The page presents three sample stories or an equivalent clearly visible set of story items.",
      "The delivered result is the requested newsletter experience, not only an untouched starter template or prose-only answer."
    ],
    "evidenceGuidance": [
      "Inspect the final workspace and run the app or open the static page if needed.",
      "Use Kestrel transcripts and event logs only as supporting evidence; judge the final delivered state."
    ],
    "calibrationCases": [
      {
        "id": "complete-newsletter-pass",
        "inputSummary": "The workspace contains an openable local page with a newsletter layout, at least three visible story items, and no obvious starter-template leftovers.",
        "expectedStatus": "passed",
        "rationale": "The delivered final state is a locally inspectable newsletter experience matching the smoke-task goal."
      },
      {
        "id": "prose-only-failure",
        "inputSummary": "The agent only wrote a README describing a newsletter page but did not deliver an openable page.",
        "expectedStatus": "failed",
        "rationale": "The user asked for a delivered newsletter experience, not implementation notes."
      },
      {
        "id": "partial-static-review",
        "inputSummary": "The workspace contains a static page with newsletter styling, but only one story item is visible and the local run path is unclear.",
        "expectedStatus": "review",
        "rationale": "The final state may contain useful delivered work, but the evaluator should not automatically pass an incomplete or hard-to-run newsletter."
      }
    ]
  }
}
