{
  "version": "ruhroh_scenario_v2",
  "id": "vite-csv-reconciliation",
  "title": "Vite CSV Reconciliation",
  "tier": "nightly",
  "kind": "real_user",
  "metadata": {
    "scenarioVersion": "1.0.0",
    "provenance": "Original Ruhroh bundled scenario authored around synthetic CSV reconciliation fixtures.",
    "createdAt": "2026-06-23",
    "updatedAt": "2026-07-07",
    "difficulty": "hard",
    "tags": [
      "vite",
      "csv",
      "data-workflow"
    ],
    "expectedRuntimeSeconds": 900,
    "networkRationale": "Allows package installation for a Vite React TypeScript app.",
    "contaminationNotes": "Original workflow and bundled CSV assets; no canonical public solution.",
    "maintainers": [
      "ruhroh-maintainers"
    ],
    "visibility": "public",
    "changelog": [
      "1.0.0: Initial published scenario."
    ],
    "lifecycle": {
      "status": "active"
    }
  },
  "userPromptPath": "instruction.md",
  "assets": [
    "assets/prompt-assets/csv-reconciliation-people"
  ],
  "run": {
    "mode": "build",
    "timeoutSeconds": 900
  },
  "requires": {
    "continuity": "workspace_plus_transcript",
    "tools": [
      "filesystem",
      "shell"
    ],
    "network": true
  },
  "loop": {
    "defaultMaxIterations": 3,
    "stopPolicy": "goal_satisfied_or_max"
  },
  "evaluation": {
    "mode": "agentic_goal_review",
    "scenarioContext": [
      "This is a local data-workflow app-development task with provided CSV assets.",
      "The prompt-assets/csv-reconciliation-people directory is the source material supplied to the run-agent.",
      "The benchmark value is CSV handling, reconciliation workflow, review state, and export/import behavior."
    ],
    "goalRubric": [
      "The final app is a Vite React + TypeScript app that can be installed and run locally by a reviewer.",
      "The app uses or embeds the supplied Source A and Source B CSV sample data.",
      "The app normalizes people records, detects likely duplicates, flags missing records, and surfaces field conflicts.",
      "The user can resolve conflicts, choose winning field values, mark duplicates reviewed, and filter by conflict type.",
      "Reconciliation counts update as review decisions change.",
      "Review state persists locally and the cleaned result can be exported as JSON or CSV and imported back."
    ],
    "evidenceGuidance": [
      "Inspect the copied prompt assets and final workspace before judging.",
      "Run build/start commands and exercise the reconciliation workflow when practical.",
      "Prefer evidence from app behavior and exported data over source text matches."
    ],
    "calibrationCases": [
      {
        "id": "complete-reconciliation-pass",
        "inputSummary": "The Vite app runs locally, uses the supplied Source A and Source B CSV data, detects duplicates, missing records, and field conflicts, supports conflict resolution and filtering, updates counts, persists review state, and exports cleaned results.",
        "expectedStatus": "passed",
        "rationale": "The delivered app satisfies the full CSV reconciliation workflow and evidence requirements."
      },
      {
        "id": "viewer-only-failure",
        "inputSummary": "The app displays both CSV files but offers no duplicate detection, conflict resolution, review state, or cleaned export.",
        "expectedStatus": "failed",
        "rationale": "Viewing data alone does not satisfy the requested reconciliation workflow."
      },
      {
        "id": "detection-no-export-review",
        "inputSummary": "The app detects likely duplicates and field conflicts, but review decisions do not persist and there is no cleaned JSON or CSV export.",
        "expectedStatus": "review",
        "rationale": "The app implements important reconciliation behavior but misses persistence and export requirements central to a publishable pass."
      }
    ]
  }
}
