{
  "version": "ruhroh_scenario_v2",
  "id": "nextjs-task-board",
  "title": "Next.js Task Board",
  "tier": "nightly",
  "kind": "real_user",
  "metadata": {
    "scenarioVersion": "1.0.0",
    "provenance": "Ruhroh bundled scenario adapted from a task-board benchmark pattern with original outcome criteria.",
    "createdAt": "2026-06-23",
    "updatedAt": "2026-07-07",
    "difficulty": "hard",
    "tags": [
      "nextjs",
      "full-stack",
      "local-api"
    ],
    "expectedRuntimeSeconds": 900,
    "networkRationale": "Allows package installation for a Next.js app.",
    "contaminationNotes": "Inspired by a task-board benchmark pattern but judged by original Ruhroh outcome criteria.",
    "maintainers": [
      "ruhroh-maintainers"
    ],
    "visibility": "public",
    "changelog": [
      "1.0.0: Initial published scenario."
    ],
    "lifecycle": {
      "status": "active"
    }
  },
  "userPromptPath": "instruction.md",
  "run": {
    "mode": "build",
    "timeoutSeconds": 900
  },
  "requires": {
    "continuity": "workspace_plus_transcript",
    "tools": [
      "filesystem",
      "shell"
    ],
    "network": true
  },
  "loop": {
    "defaultMaxIterations": 3,
    "stopPolicy": "goal_satisfied_or_max"
  },
  "evaluation": {
    "mode": "agentic_goal_review",
    "scenarioContext": [
      "This is a local full-stack Next.js app-development task.",
      "The scenario is inspired by Mountaintop's task-board case, but Ruhroh should judge the delivered user workflow rather than static required artifact names.",
      "External databases and hosted services are out of scope; persistence should be local to the workspace."
    ],
    "goalRubric": [
      "The final workspace provides a local full-stack Next.js task board app.",
      "The app supports creating, editing, and archiving tasks through a visible UI.",
      "The app validates empty input and has a sensible empty state.",
      "Task data persists through a local API or server route backed by workspace-local file storage, not only browser localStorage.",
      "The app builds successfully and avoids obvious scaffold/runtime errors.",
      "A reviewer can run the app locally and verify the task workflow."
    ],
    "evidenceGuidance": [
      "Run install/build/start commands in the eval workspace when practical.",
      "Explore the UI/API workflow as a user: create, edit, archive, empty validation, and persistence after reload or restart.",
      "Do not require Mountaintop's historical filenames as a pass/fail condition unless the user-facing delivered app otherwise fails the workflow."
    ],
    "calibrationCases": [
      {
        "id": "complete-server-persistence-pass",
        "inputSummary": "The Next.js app builds and runs locally, supports creating, editing, archiving, empty-state validation, and persists tasks through a local API or server route backed by workspace-local storage.",
        "expectedStatus": "passed",
        "rationale": "The delivered app satisfies the full-stack task-board workflow and persistence requirements."
      },
      {
        "id": "ui-only-failure",
        "inputSummary": "The workspace contains a task-board UI mockup, but there is no working create/edit/archive flow and no local API or server persistence path.",
        "expectedStatus": "failed",
        "rationale": "A static UI shell does not satisfy the required full-stack task workflow."
      },
      {
        "id": "localstorage-review",
        "inputSummary": "The task board UI works, but persistence is only browser localStorage instead of a local API or server route.",
        "expectedStatus": "review",
        "rationale": "The scenario requires workspace-local server persistence, but a reviewer may need to decide whether the delivered workflow is otherwise strong enough to rerun or fail."
      }
    ]
  }
}
