{
  "version": "ruhroh_scenario_v2",
  "id": "grocery-budget-planner",
  "title": "Grocery Budget Planner",
  "tier": "nightly",
  "kind": "real_user",
  "metadata": {
    "scenarioVersion": "1.0.0",
    "provenance": "Original Ruhroh bundled scenario authored for outcome-based local-app benchmarking.",
    "createdAt": "2026-06-23",
    "updatedAt": "2026-07-07",
    "difficulty": "standard",
    "tags": [
      "local-app",
      "persistence",
      "budgeting"
    ],
    "expectedRuntimeSeconds": 600,
    "contaminationNotes": "Original local-app workflow with no canonical public solution.",
    "maintainers": [
      "ruhroh-maintainers"
    ],
    "visibility": "public",
    "changelog": [
      "1.0.0: Initial published scenario."
    ],
    "lifecycle": {
      "status": "active"
    }
  },
  "userPromptPath": "instruction.md",
  "run": {
    "mode": "build",
    "timeoutSeconds": 600
  },
  "requires": {
    "continuity": "workspace_plus_transcript",
    "tools": [
      "filesystem",
      "shell"
    ],
    "network": false
  },
  "loop": {
    "defaultMaxIterations": 3,
    "stopPolicy": "goal_satisfied_or_max"
  },
  "evaluation": {
    "mode": "agentic_goal_review",
    "scenarioContext": [
      "This is a dependency-free local app-development task.",
      "The user asked for an immediately usable grocery budget planner, not a prose plan.",
      "The user did not prescribe a framework or file layout."
    ],
    "goalRubric": [
      "The final workspace provides a locally usable grocery budget planner.",
      "The app supports adding grocery items with name, category, estimated price, and purchased state.",
      "The app groups or clearly organizes items by category.",
      "Purchased and unpurchased totals plus remaining budget update when the list changes.",
      "Starter dinner grocery data is present and local persistence survives reloads."
    ],
    "evidenceGuidance": [
      "Inspect the final workspace and run or open the local app when practical.",
      "Exercise the user workflow: add an item, mark an item purchased, and verify totals update.",
      "Do not require a specific filename or framework unless the delivered app itself documents that as its local run path."
    ],
    "calibrationCases": [
      {
        "id": "complete-budget-planner-pass",
        "inputSummary": "The app starts locally, includes starter grocery data, supports adding and purchasing items by category, updates purchased/unpurchased totals and remaining budget, and persists changes after reload.",
        "expectedStatus": "passed",
        "rationale": "The delivered app satisfies the requested grocery budget workflow with the required state and totals behavior."
      },
      {
        "id": "totals-missing-failure",
        "inputSummary": "The app lists grocery items but never updates purchased, unpurchased, or remaining budget totals.",
        "expectedStatus": "failed",
        "rationale": "Dynamic budget totals are central to the requested planner workflow."
      },
      {
        "id": "persistence-ambiguous-review",
        "inputSummary": "The app supports adding items and updating totals during one session, but persistence after reload is missing or cannot be verified from the preserved artifacts.",
        "expectedStatus": "review",
        "rationale": "The core workflow exists, but persistence is a stated requirement and ambiguous evidence should trigger reviewer adjudication."
      }
    ]
  }
}
